{
  "schema_version": "substitute_comparison_record_v0",
  "scenario_id": "SUBSTITUTE_SCENARIO_FRESH_ORCHESTRATION_005",
  "scenario_class": "fresh_orchestration_non_resumable_contour",
  "task_class": "bounded_router_trigger_fix",
  "substitute_stack": "manual_forward_orchestration_runbook",
  "substitute_family": "forward_orchestration_runbook_stack",
  "substitute_path": "manual_forward_orchestration_runbook",
  "synrail_path": "fresh_orchestration_non_resumable_kernel",
  "substitute": {
    "schema_version": "comparison_input_v2",
    "system": "substitute",
    "scenario_id": "SUBSTITUTE_SCENARIO_FRESH_ORCHESTRATION_005",
    "scenario_class": "fresh_orchestration_non_resumable_contour",
    "task_class": "bounded_router_trigger_fix",
    "path_id": "manual_forward_orchestration_runbook",
    "substitute_stack": "manual_forward_orchestration_runbook",
    "substitute_family": "forward_orchestration_runbook_stack",
    "closure_result": "BLOCKED",
    "blocker_to_closure_cycles": 2,
    "false_success_risk": "MEDIUM",
    "proof_completeness": "MEDIUM",
    "recovery_cost": "MEDIUM",
    "coordination_overhead": "LOW",
    "operator_minutes": 15,
    "intervention_count": 2,
    "repair_cycles": 1,
    "invalidation_count": 0,
    "closure_latency_minutes": 20,
    "false_green_exposure": 1,
    "artifact_completeness_percent": 54,
    "notes": "a manual forward-orchestration runbook can redirect the operator away from the wrong resume path, but the non-resumable boundary still depends on human interpretation instead of one runtime-owned cutoff"
  },
  "synrail": {
    "schema_version": "comparison_input_v2",
    "system": "synrail",
    "scenario_id": "SUBSTITUTE_SCENARIO_FRESH_ORCHESTRATION_005",
    "scenario_class": "fresh_orchestration_non_resumable_contour",
    "task_class": "bounded_router_trigger_fix",
    "path_id": "fresh_orchestration_non_resumable_kernel",
    "closure_result": "BLOCKED",
    "blocker_to_closure_cycles": 1,
    "false_success_risk": "LOW",
    "proof_completeness": "HIGH",
    "recovery_cost": "LOW",
    "coordination_overhead": "MEDIUM",
    "operator_minutes": 17,
    "intervention_count": 1,
    "repair_cycles": 0,
    "invalidation_count": 0,
    "closure_latency_minutes": 18,
    "false_green_exposure": 0,
    "artifact_completeness_percent": 90,
    "notes": "Synrail names the fresh-orchestration boundary as not resumable, blocks the wrong resume path immediately, and points the operator back to the governed forward contour without hidden judgment"
  },
  "economics_summary": {
    "operator_minutes_added": 2,
    "intervention_count_added": -1,
    "repair_cycles_added": -1,
    "invalidation_count_added": 0,
    "closure_latency_minutes_added": -2,
    "blocker_to_closure_cycles_added": -1,
    "false_green_exposure_reduced": 1,
    "artifact_completeness_percent_gain": 36
  },
  "verdict": "SYNRAIL_BETTER",
  "why_verdict": "Synrail materially outperforms this simpler substitute stack on truth preservation and repairability, even though it costs more coordination.",
  "reasons": [
    "synrail_reduces_substitute_false_green_exposure",
    "synrail_improves_substitute_proof_basis",
    "synrail_lowers_substitute_repair_cost",
    "synrail_adds_control_overhead"
  ]
}
