{
  "schema_version": "substitute_comparison_record_v0",
  "scenario_id": "SUBSTITUTE_SCENARIO_WEAK_002",
  "scenario_class": "low_risk_honesty_restoration",
  "task_class": "honesty_restoration_guard",
  "substitute_stack": "bounded_patch_validation_loop",
  "substitute_family": "lightweight_patch_stack",
  "substitute_path": "bounded_patch_validation_loop",
  "synrail_path": "full_governed_path",
  "substitute": {
    "schema_version": "comparison_input_v2",
    "system": "substitute",
    "scenario_id": "SUBSTITUTE_SCENARIO_WEAK_002",
    "scenario_class": "low_risk_honesty_restoration",
    "task_class": "honesty_restoration_guard",
    "path_id": "bounded_patch_validation_loop",
    "substitute_stack": "bounded_patch_validation_loop",
    "substitute_family": "lightweight_patch_stack",
    "closure_result": "ACCEPTED",
    "blocker_to_closure_cycles": 0,
    "false_success_risk": "LOW",
    "proof_completeness": "MEDIUM",
    "recovery_cost": "LOW",
    "coordination_overhead": "LOW",
    "operator_minutes": 9,
    "intervention_count": 1,
    "repair_cycles": 0,
    "invalidation_count": 0,
    "closure_latency_minutes": 12,
    "false_green_exposure": 0,
    "artifact_completeness_percent": 65,
    "notes": "lightweight patch validation is still plausible on the weak path"
  },
  "synrail": {
    "schema_version": "comparison_input_v2",
    "system": "synrail",
    "scenario_id": "SUBSTITUTE_SCENARIO_WEAK_002",
    "scenario_class": "low_risk_honesty_restoration",
    "task_class": "honesty_restoration_guard",
    "path_id": "full_governed_path",
    "closure_result": "CLAIMED_NOT_ACCEPTED",
    "blocker_to_closure_cycles": 2,
    "false_success_risk": "LOW",
    "proof_completeness": "HIGH",
    "recovery_cost": "LOW",
    "coordination_overhead": "HIGH",
    "operator_minutes": 27,
    "intervention_count": 4,
    "repair_cycles": 1,
    "invalidation_count": 1,
    "closure_latency_minutes": 31,
    "false_green_exposure": 0,
    "artifact_completeness_percent": 90,
    "notes": "tightened kernel still does not obviously beat a light substitute on this weak path"
  },
  "economics_summary": {
    "operator_minutes_added": 18,
    "intervention_count_added": 3,
    "repair_cycles_added": 1,
    "invalidation_count_added": 1,
    "closure_latency_minutes_added": 19,
    "blocker_to_closure_cycles_added": 2,
    "false_green_exposure_reduced": 0,
    "artifact_completeness_percent_gain": 25
  },
  "verdict": "UNCLEAR",
  "why_verdict": "The current substitute test shows real differences in both truth discipline and cost, but not enough to claim a decisive winner yet.",
  "reasons": [
    "synrail_improves_substitute_proof_basis",
    "synrail_adds_control_overhead",
    "synrail_requires_more_operator_interventions",
    "synrail_increases_closure_latency"
  ]
}
